,title,paragraphs
61,Recycled Paper,"['Project Drawdown defines recycled paper as: the increased recovery and reprocessing of used paper into paper products. This solution replaces the use of virgin paper feedstocks', 'Recycled paper is a form of paper that is made, at least in part, of paper, fiber, or pulp that has been reprocessed after usage, disposal, and recovery. Conventional, or virgin, paper is produced through chemical or mechanical processes that utilize virgin tree pulp fibers. Processing recycled paper content involves processes such as sorting, shredding, hydropulping, and deinking, whereas conventional paper involves distinct steps such as harvesting, debarking, chipping, and mechanical or chemical pulping. Both production processes use energy and emit greenhouse gases as a result, but starting with a recovered paper feedstock uses less energy and results in lower greenhouse gas emissions. \xa0\xa0\xa0\xa0\xa0\xa0\xa0\xa0\xa0\xa0 \xa0\nMethodology\nTo arrive at the results for mitigation impact and financial considerations for recycled paper, Project Drawdown first needed to calculate a forecast for total paper production from 2014 to 2050 (in million metric tons), then determine the current adoption[1] of recycled paper, forecast future adoption scenarios of recycled paper for that period, derive an emissions mitigation value per million metric tons of recycled paper produced, and calculate the emissions mitigated and costs in comparison with a Reference Scenario that keeps adoption of recycled paper at its current percentage of global paper adoption', ""Total Addressable Market[2]\nThe total addressable market for paper was measured using data from industry and academic research. The primary data source is the United Nations Food and Agriculture Organization (FAO), and some regions’ projected markets are based on statistical consulting company RISI, Inc.'s paper production projections through 2030, and McKinsey & Co (2013). RISI’s statistics were not always aligned with FAO’s data; thus, other sources, including the Confederation of European Paper Industry (CEPI), Buongiorno’s Global Forest Projection Models, and more were used and averaged. The annual growth/decline rates of each region were extrapolated through to 2050"", 'The current global recycled paper production rate is around 55 percent, with Western Europe leading with nearly 75 percent\xa0(primarily due to established infrastructure in Scandinavian countries) and India, Eastern Europe, China, and other Asian and Middle Eastern regions trailing (Buongiorno et al. 2003)', 'Adoption Scenarios[3]\nCustom adoption scenarios for recycled paper were created by taking regional and global data prognostications as current growth rates for recycling. Western Europe’s recovery rate of 75% is considered to the feasible maximum of paper recycling currently.\xa0\nImpacts of increased adoption of industrial recycling from 2020-2050 were generated based on two growth scenarios, which were assessed in comparison to the\xa0Reference\xa0Scenario mentioned above', '\nScenario 1: Based on the low-growth-trend best fit analysis of the custom adoption scenarios, the production of 621 million metric tons of recycled paper is assumed in 2050, which is 69% of the market. The low was chosen due to the highly uncertain nature of the paper market beyond 2030, especially in emerging markets', 'Scenario 2: Here, adoption is accelerated after 2020 to the high-growth-trend best fit line and then capped at 74% of the market, or 684 million metric tons of recycled paper. A lower market for recycled paper is also chosen to reflect the integrated waste generation metrics from an integrated measure of global waste and its composition, including all Drawdown solutions', '\nEmissions Model\nClimate inputs analyzed included direct and indirect carbon dioxide emissions for recycled and conventional paper products. The unit of measure was metric tons of carbon dioxide-equivalent produced per metric ton of paper produced. Data from outside North America, the Netherlands, Norway, Sweden, and parts of Europe was not available for emissions calculation. Emissions due to paper manufacturing process are analyzed as direct emissions. Emissions from all other life cycle stages of virgin and recycled paper production are analyzed as indirect emissions', 'Life cycle analyses trace the amount of emissions from a product’s ‘cradle to grave’. Emissions could be attributed to the initial timber harvest, or to the processing, transportation, consumption, and disposal stages. Some sources attempted to trace these emissions through every process, while others only measured emissions at the manufacturing stage, i.e. when mills receive pulp and then process it to produce recycled or virgin paper. Modeling emissions associated with paper and paper-making, such as deforestation or carbon sequestered as a result of recycled paper, was outside the scope of the analysis', 'Financial Model\nFinancial research focused on the first costs of purchasing paper by the consumer. In this case, the agent considered was a US-based paper consumer, and the first costs were those that an individual would face when purchasing recycled rather than conventional paper products. Due to the variety of paper products and the differences in grades and qualities, several assumptions had to be made in order to conduct a financial analysis. Facing a lack of available industry data, research was conducted via a market spot-check price comparison. A single type of paper – uncoated office/copy paper – was considered as an appropriate primary price marker. Different types of paper were added to proportionally reflect a more accurate price', 'Results\nThe total carbon dioxide-equivalent reductions that can be achieved from 2020-2050 in the Scenario 1 are 1.1 gigatons, with a marginal first cost of $456 billion.[4] The Scenario 2s shows a mitigation of 1.95 gigatons from 2020-2050', 'Discussion\nRecycled paper directly emits, on average, 0.15 metric tons of carbon dioxide-equivalent less per metric ton produced than virgin paper; thus, it is a climate reduction solution to be considered. Global paper production and consumption is predicted to rise globally, especially in emerging economies where paper and packaging is in high demand. However, several developed economies are gradually reducing their paper production and consumption rates. This is due to decreasing stocks of virgin source materials, as well as decreased demand due to the substitution of electronic media, especially in its role of replacing newsprint. The growth of electronic media will play a very important part in the paper industry’s growth or decline in the future. The potential for recycled paper as a material reduction solution depends on the growth of the paper market globally, as well as on a change in consumer preferences and a decrease in cost', '\xa0\n\n\n[1] Current adoption is defined as the amount of functional demand supplied by the solution in the base year of study. This study uses 2014 as the base year due to the availability of global adoption data for all Project Drawdown solutions evaluated', '\n\n[2] For more on the Total Addressable Market for the Materials Sector, click the Sector Summary: Materials link below', '\n\n[3] For more on Project Drawdown’s three growth scenarios, click the Scenarios link below. For information on Materials Sector-specific scenarios, click the Sector Summary: Materials link', '\n\n[4] All monetary values are presented in US2014$.']"
62,Recycling,"['Project Drawdown defines recycling as\xa0the increased recovery of recyclable materials, not including paper nor organic materials, from the industrial and residential sectors of the economy. This solution replaces the disposal of recyclable materials in landfills', 'Recovering and recycling waste materials for use in new products reduces the amount of materials manufactured from virgin sources, produces less greenhouse gas emissions, and reduces the environmental burden created if the waste is disposed in overcrowded landfills. Waste considered in this solution is postconsumer waste, measured at waste collection centers.[1] Recyclable waste types considered for this solution are metals, plastic, glass, and other.[2] Waste that is recyclable makes up around 37 percent\xa0of total municipal solid waste generated globally', 'Methodology\nMunicipal solid waste is defined differently by governments, organizations, and researchers; for this solution, all sources include both household and commercial waste in aggregate values reported. Because the fraction of total waste allocated to households and commercial or industrial waste generators is not often reported, it is assumed that 50 percent\xa0of recyclable waste is derived from the industrial sector (US EPA, 1998)', 'Total Addressable Market\nThe total addressable market for recyclable waste was calculated using a composite of forecasts, including a linear interpolation of World Bank data from 2010 to 2025, an extrapolation to extend those projections to 2050, and a per capita extrapolation using data from the Intergovernmental Panel on Climate Change (IPCC).[3] It is estimated that by 2050, global organic waste will be approximately 1459 million metric tons. Current adoption[4] of both household and commercial recycling in\xa02014 was estimated at 27 percent of recyclable waste (see Hoornweg and Bhada-Tata, 2012)', 'Adoption Scenarios\nDue to the lack of reliable future projections of the growth of recycling, three custom adoption estimates were developed based on increasingly ambitious recycling rates per region.[5] In the first estimate, all 2050 non-OECD regional rates are set to the 2014 OECD recycling rate of approximately 57 percent. In the second estimate, non-OECD countries’ recycling target rate for 2050 is set to the current Austrian recycling rate of 63 percent. In the third estimate, recycling rates for non-OECD countries, recycling rates in 2050 are set to correspond with the current best recycling rate of the country in the corresponding region. For example, Asia (sans Japan) region’s recycling rate target is set to 61 percent, which is Singapore’s recycling rate in 2015. From these estimations, adoption boundaries were created from which the Project Scenario 2s were derived', 'Impacts of increased adoption of household recycling from 2020 to 2050 were generated based on two growth scenarios. These\xa0were assessed in comparison with\xa0a\xa0Reference\xa0Scenario, in which\xa0the solution’s market share was fixed at the current levels', '\nScenario 1: In this scenario it is assumed that recycling will increase from present rates to 65 percent\xa0of the market,[6] amounting to 941 million metric tons of recycled material in 2050 total', 'Scenario 2: In this scenario, complete optimization of source separation and collection processes as well as aggressive zero waste policy adoption are assumed. The amount of total recycled waste in 2050 is 984 million metric tons', '\nFinancial Model\nFinancial results were created by comparing the costs of creating and operating material recovery facilities or mechanical-biological treatment facilities to creating and operating sanitary landfills for an equivalent volume of recyclable waste. The marginal first cost is US$10 billion. When revenues from recovered materials are included in comparison to the costs of virgin materials, however, operating recycling facilities costs less than operating landfills and sourcing virgin material feedstocks for industry.\xa0\nIntegration\nFor integration into the Materials Sector, Project Drawdown first considers the reduction in recyclable waste due to the increased adoption of the assumed compostable fraction of bioplastic.\xa0 The recyclable fraction of waste decreases year to year as the fraction of recyclable plastic used by humanity decreases, so that as the adoption scenarios become optimized the overall adoption of household recycling decreases yet the adoption percentage increases. \xa0\nResults\nIn Scenario 1, Project Drawdown found a potential 5.5 gigaton reduction in carbon dioxide-equivalent emissions over 2020–2050, corresponding to a 65 percent\xa0adoption of recycling of recyclable waste. This came with a net implementation cost of US$10 billion but a net operational savings over the same period of US$142 billion.\xa0 For Scenario 2, the emissions avoided amount to 6.02 gigatons with a 68 percent\xa0adoption', 'Discussion\nHousehold and industrial recycling are keystone elements of a circular economy that provides industry with feedstocks to produce needed goods with fewer emissions. Recycling also generates unmeasured benefits by extending the life of sanitary landfills and creating economic opportunity and activity in material recovery and reprocessing', 'Limitations\nThe state of currently operating landfills and material recovery facilities could not be easily determined within the scope of this study. Because of the limitations to establish how much waste can be landfilled in currently operating landfills and how much of the capacity of currently operating material recovery facilities is not exploited to its full potential, first costs of such facilities are calculated for installing completely new facilities. Similar limitations of the study have been identified with establishing first costs of introducing new solid waste collection systems by municipalities, and the unused capacity of existing ones.\xa0 Additionally, much of the complexity of recycling ceramics, rubber, textiles and e-waste have been oversimplified with the approach taken.\xa0 Finally, it is also likely the development in the technologies of material recycling, product recycling and end-of-pipe technologies such as waste identification and sorting technologies, waste disassembly and shredding technologies, and material recovery technologies will have positive impacts on lowering first costs and operating costs of recycling', '\n\n\n[1] Pre-consumer waste is found in far smaller amounts: Only 10 percent\xa0of total postconsumer waste generated by households, residential, commercial, and institutional subjects. Pre-consumer waste is also almost 100 percent\xa0recyclable on-site. The amount of pre-consumer waste that is lost from the material cycle is hence negligible (EU Joint Center 2002)', '\n\n[2] Note that recycled paper\xa0is excluded and assessed by another Project Drawdown solution', '\n\n[3] Using UN 2015 median urban population forecast', '\n\n[4] Current adoption is defined as the amount of functional demand supplied by the solution in the base year of study. This study uses 2014 as the base year due to the availability of global adoption data for all Project Drawdown solutions evaluated', '\n\n[5] Regions include: Organisation for Economic Co-operation and Development (OECD), Eastern Europe, Asia (sans Japan), Middle East & Africa, Latin America & Caribbean', '\n\n[6] Integration with other Project Drawdown solutions causes the total addressable market to decrease and the percentage adoption to increase. The adoption percentage of the Scenario 1 post-integration is 81 percent.']"
63,Reduced Food Waste,"['Project Drawdown defines reduced food waste as\xa0minimizing food loss and wastage from all stages of production, distribution, retail, and consumption. This solution replaces current reported trends in food waste by region', 'Estimates suggest that 30–40 percent of all food produced worldwide is wasted across the supply chain (Smith, P. et al., 2014). When food is wasted, all the energy, resources, and money that went into producing, processing, packaging, and transporting it are wasted too. The further down the supply chain the food gets before it is thrown out, the more resources are wasted to get it to that stage. If measures are taken to reduce food waste by improving storage and transport systems, generating public awareness, and changing consumer behavior, this solution could lead to substantial reductions in waste and carbon emissions', 'Methodology\nTo evaluate the impact of reduced food waste, an independent model was created outside Drawdown’s core model framework to project food consumption and waste from 2020 to 2050. This was required due to the complexity of estimating country- and regional-scale food consumption and waste trends based on reported commodity types along the supply chain', 'Total Addressable Market\nThe global market for reduced food waste is defined as the total demand for food, based on estimated kilocalories supplied per year for consumption by the world’s population. The baseline food consumption is projected for all countries up to 2060 in kilocalories per capita per year, using data compiled by the Food and Agriculture Organization (FAO) for the year 2013.[1] Future consumption is forecasted using growth factors from Alexandratos et al. (2012), which reflect projected dietary changes.[2]\nTotal food loss and wastage is calculated according to regional estimates of waste generated at each supply chain stage[3] (FAO, 2011), applied to aggregated country-level food demand by commodity type. Current adoption[4] of reduced food waste is considered to be 0\xa0percent', 'Adoption Scenarios[5]\nImpacts of increased adoption of reduced food waste from 2020 to 2050 were generated based on three growth scenarios. These\xa0were assessed in comparison with\xa0a\xa0Reference\xa0Scenario, in which\xa0the solution’s market share is fixed at the current levels', 'Adoption scenarios in this model grow linearly over time starting from the base year of 2014, and are considered complete\xa0in 2050. Linear growth trends were chosen because of the lack of country or regional data; additional behavioral research at more granular scales can reveal more representative adoption estimates', 'For reduced food waste, three scenarios were developed:\n\nScenario 1: This scenario assumes that a 50 percent reduction in total global food loss and wastage will be achieved by 2050', 'Scenario 2: In this scenario, a 75 percent reduction in total global food loss and wastage by 2050 is modeled', '\nEmissions Model\nTo estimate emissions, commodity-specific carbon dioxide-equivalent per-calorie values were drawn from several sources (see Audsley et al., 2010; Heller and Keoleian, 2014; Hoolohan et al., 2013; Tilman and Clark, 2014; Vieux et al., 2012) to determine minimum, average, and maximum estimated emissions factors per commodity. The emissions factors were multiplied by the baseline annual food demand by country and commodity to get the carbon dioxide-equivalent values for food items over time. Emissions estimates were aggregated by commodity types[5] and regions classified by the FAO (2011), and are aligned with regions used by Project Drawdown', 'FAO regional estimates of food loss and wastage by commodity types across the supply chain stages were applied to aggregated emissions values associated with regional food demand. Emissions reductions were calculated based on the incremental adoption of reduced food waste, which was applied across all stages of the supply chain. Resulting emissions reductions were aggregated to represent the total global reduction from avoided agricultural production', 'Integration\nProject Drawdown calculated the total reduction in food loss and wastage by weight (in million metric tons) by commodity type. It was assumed that reduced loss and wastage can be diverted to feed current and future undernourished populations. Diverted tonnage of food was used as an input in the Project Drawdown Integrated Yield Model, which combines all agricultural production models to determine the required yield to meet the estimated food and bio-based product demand on an annual basis. Results from all demand-side solutions, i.e., reduced food waste and plant-rich diet, determine the need for land conversion to cropland and grassland in order to meet future food demand. Emissions reductions associated with land conversion were applied to both reduced food waste and plant-rich diet according to the proportion of their contribution to diverted food supply', 'In addition, the results of reduced food waste were applied to solution models in the Materials Sector that utilize organic municipal solid waste', 'Results\nBetween 2020 and 2050, Scenario 1 projects the reduction of 90.70 gigatons of carbon dioxide-equivalent emissions: 13.57\xa0gigatons due to diverted agricultural production, 76.33 gigatons from avoided land conversion, and 0.80 gigatons from ecosystem protection', 'Scenario 2 projects the reduction of 101.71 gigatons of carbon dioxide-equivalent emissions: 25.97 gigatons due to diverted agricultural production, 74.96 gigatons from avoided land conversion, and 0.78 gigatons from sequestration from ecosystem protection', 'Discussion\nFood loss and waste has many negative economic and environmental impacts. The global economic, environmental, and social cost of food wastage is estimated at US$2.6 trillion, which is nearly equal to the GDP of France (FAO, 2014). Food waste generates unnecessary greenhouse gas emissions and wastes both water and land, negatively impacting natural ecosystems', 'Reducing food loss and waste can also help close the over 60 percent gap between food available today and food needed in 2050, thereby working toward eliminating hunger. Although solutions at consumer level are difficult to implement and hard to measure, they must be pursued at regions with high levels of consumer food waste. Food loss and waste measurement tools must be developed to standardize the measurement and reporting. Food waste reduction targets should be set not only at country levels, but also broken down to corporate, supplier, and consumer levels. Incentives for waste reduction should be designed and provided to influence behavior change. Reducing food waste is a big physical problem. But it has widespread benefits for the economy, the environment, society, and human health.\xa0\nNote: August 2021 corrections appear in boldface', '\n\n\n[1] http://www.fao.org/faostat/en/#data\n\n\n[2] The projected dietary changes show significant impacts for countries like India and China, whose populations are expected to demand more carbon-intensive foods over the next 30 years', '\n\n[3] Supply chain stages are defined as: agricultural production, postharvest handling and storage, processing, packaging, distribution, and consumption', '\n\n[4] Current adoption is defined as the amount of functional demand supplied by the solution in the base year of study. This study uses 2014 as the base year due to the availability of global adoption data for all Project Drawdown solutions evaluated', '\n\n[5] Commodity types include: cereals, roots and tubers, oilseeds and pulses, fruits and vegetables, meat, fish and seafood, and milk.']"
