,title,paragraphs
0,Abandoned Farmland Restoration,"['Project Drawdown describes abandoned farmland restoration as: a set of processes for restoring degraded, abandoned land to productivity and biosequestration. This solution replaces the conventional practice of abandoning degraded grassland', 'Abandonment of farmland have been increased in the last two centuries. The failure of these lands to continue to produce the desired economic benefits has forced the land owners to abandon them. The loss of the agricultural productivity of these lands poses a serious threat to food security. These lands have also lost substantial carbon from soil and biomass in the process of becoming degraded', 'Restoring these lands to productivity sequesters carbon, while bringing land back into production. This can also result in substantial reduced emissions from avoided deforestation, though that impact is not modeled here. This model looks only at agricultural restoration, though restoration to forests and other ecosystems is also practiced on abandoned farmland', 'Given the urgency of preventing emissions from deforestation, and the pressure of meeting food demand given the trend towards increasing meat consumption, abandoned farmland restoration is highly desirable. Its impressive carbon sequestration impact, along with these co-benefits, makes it an essential component of mitigation efforts', 'Methodology\nTotal Land Area\nThe total available land for the abandoned farmland restoration solution is 371 million hectares,[1] which is allocated on degraded grasslands. Though abandoned land that has been restored is by definition now in agricultural production or is a restored forest or other ecosystem, 20 million hectares are reported to be under active restoration in globally; thus, this number is used as current adoption[2] of abandoned farmland restoration', 'It is assumed that the process of restoration takes one year, after which the land returns to production. Restored land is assumed to be in Drawdown’s regenerative annual cropping solution, as the majority of restoration measures are based on improving soil fertility through organic inputs. This area, however, is not included in the total adoption area for the regenerative annual cropping solution', 'Adoption Scenarios\nProjections on restoration of abandoned farmland are unavailable. However, abandoned farmland is a subset of degraded farmland, for which published targets are available. Thus, six custom adoption scenarios were developed, based on the Intergovernmental Panel on Climate Change (IPCC),United Nations Environment Program (UNEP)’s 2013 low and high targets for restoration of degraded land and historical trends available for China, EU, and Kazakhstan. In the absence of targeted data, this study assumes that both abandoned and degraded land will follow similar trends', 'Impacts of increased adoption of abandoned farmland restoration from 2020 to 2050 were generated based on two growth scenarios, which were assessed in comparison to a\xa0Reference\xa0Scenario where the solution’s market share was fixed at the current levels', '\nScenario 1: The analysis of these custom scenarios shows restoration of 189.5 million hectares of abandoned farmland', 'Scenario 2: Aggressive adoption of abandoned farmland restoration yields restoration of 296.1 million hectares of abandoned farmland', '\nSequestration Model\nCarbon sequestration rates are set at 1.3 tons per hectare per year, based on meta-analysis of 31 data points from four\xa0sources', 'Financial Model\nFirst cost for the abandoned farmland restoration solution is US$561.6 per hectare,[3] based on meta-analysis of 17 data points from five\xa0sources. There is no conventional first cost for comparison, as the land is assumed to have been abandoned for some time. The net profit margin and operational cost is taken from the regenerative annual cropping model, as it is assumed that this solution will eventually adopt regenerative annual cropping practices', 'Integration\nIn the process of allocating land to solutions by Agro-Ecological Zone, it was assumed that abandoned farmland is currently degraded grassland', 'Results\nTotal adoption in the Scenario 1 is 189.5 million hectares in 2050, representing 51 percent of the total available land. Of this, 169.48 million hectares are adopted from 2020 to 2050. The sequestration impact of this scenario is 12.48 gigatons of carbon dioxide-equivalent by 2050. Marginal first cost is US$98.2 billion and lifetime operational cost is US$3.2 trillion. Net savings is US$2.6 trillion. Total yield of food from this previously abandoned land is 9.2 billion metric tons between 2020 and 2050', 'Total adoption in the Scenario 2 is 296.1 million hectares in 2050, representing 80 percent of the total available land. Of this, 276.09 million hectares are adopted from 2020 to 2050. The impact of this scenario is 20.32 gigatons of carbon dioxide-equivalent by 2050. Marginal first cost is US$159.9 billion and lifetime operational cost is US$5.2 trillion. Net savings is US$4.3 trillion. Total yield of food from this previously abandoned land is 15 billion metric tons between 2020-2050', 'Discussion\nBenchmarks\nProjected impacts for this solution align very closely with IPCC projections for the restoration of degraded land. The IPCC estimates an impact of 0.1–0.7 gigatons of carbon dioxide-equivalent per year by 2030 (Smith, 2007), while the Project Drawdown model shows 0.3–0.5 gigatons per year in 2030, well within the benchmark range', 'Limitations\nFor future upgrades of this solution, it would be useful to further investigate how “abandoned farmland” is categorized and how it is distinct from degraded lands in general', 'Conclusions\nIt should be seen as somewhat embarrassing for humanity that we continue to clear land for agriculture while leaving degraded, once-fertile lands behind in an abandoned state. The multiple mitigation benefits associated with abandoned farmland restoration provide strong incentive to bring these lands back into production and care for them thereafter', '\xa0\n\n[1] Determining the total available land for a solution is a two-part process. The technical potential is based on the suitability of climate, soils, and slopes, and on degraded or non-degraded status. In the second stage, land is allocated using the Drawdown Agro-Ecological Zone model, based on priorities for each class of land. The total land allocated for each solution is capped at the solution’s maximum adoption in the Optimum Scenario. Thus, in most cases the total available land is less than the technical potential', '\n\n[2] Current adoption is defined as the amount of functional demand supplied by the solution in the base year of study. This study uses 2014 as the base year due to the availability of global adoption data for all Project Drawdown solutions evaluated', '\n\n[3] All monetary values are presented in 2014 US$.']"
1,Alternative Cement,"['Project Drawdown defines alternative cement as: the partial replacement of clinker with alternative materials (such as fly ash, slag, natural pozzolans, and calcined clays) to reduce the quantity of clinker in ordinary portland cement systems. Additionally, alternative cements as a solution includes efficiency upgrades to cement plants that produce clinker, reducing its carbon intensity. The practices of making clinker more efficiently and reducing the ratio of clinker to cement reduces the emissions as compared to conventional ordinary portland cement systems', 'In 2016, 1.46 gigatons of carbon dioxide was released as a result of cement production (Andrew, 2018). While cement is only about 10% of total volume in concrete, it is responsible for about 95 percent\xa0of the total emissions. For the Project Drawdown solution alternative cement, the forecasted demand of cement was collected from various global projections. Adoption of the solution within the global cement demand is twofold; reduction in clinker intensity\xa0and improvements to the thermal and electricity intensity of a metric ton\xa0of cement. The reduction in clinker intensity is achieved by replacing ordinary portland cement with alternative cementitious materials, or pozzolans, which also have binding capabilities. Such alternative materials include industrial waste products such as fly ash and slag, in addition to naturally occurring materials such as natural pozzolans, calcined clays, and limestone, which all have lower carbon dioxide emissions. The amount of clinker reduction is determined based upon the adoption of low clinker-to-cement ratio mix designs, of which there are many. Thermal and electricity intensity of clinker production is reduced\xa0by upgrading cement kilns to modern\xa0standards, such as the use of pre-calciners and dry-kiln technologies', 'Methodology\nTo measure the impact of alternative cement, a set of adoption scenarios was developed for low-clinker cement in the context of international cement standards (ASTM and CEM). These scenarios were then compared to a Reference Scenario that fixed the adoption of low-clinker cement at its current percentage of the market. Finally, emissions mitigation and financial results were drawn by comparing scenarios using an analyzed set of variables to describe the relative emissions and costs of ordinary portland cement and low-clinker cement', 'The availability of alternative cementitious materials to replace clinker is evaluated. A fly ash availability model is developed based upon time series supply and demand data for coal production and evaluated between 2020 and 2050 as the basis to limit future fly ash availability. The supply of other clinker-replacement materials, such as calcined clays and limestone, largely outweighs the total demand for cement into the future, so\xa0the supply of clinker replacements does not bound the model', 'Total Addressable Market[1]\nHistorical data indicate\xa0that in 2018 the global cement market was about 4061 million metric tons per year with an average clinker-to-cement ratio of 0.69—or current adoption of alternative cements is\xa0at 31 percent\xa0of market. In 2050, the total global cement market is estimated at 4147 million metric tons per year with varying adoption based upon the scenario. This market is developed based on estimates from the International Energy Agency, IIASA, in addition to forecasts from peer-reviewed literature', 'Adoption Scenarios[2]\nAdoption scenarios are modeled on average total global adoption of alternative cements. Therefore, we estimate 100 percent\xa0of the TAM’s clinker-to-cement ratio decreasing from 0.69 in 2018 to between 0.46 and 0.61 by 2050. The varying clinker-to-cement ratio is based on cement standards currently adopted by the global cement industry. Impacts of increased adoption of alternative cement from 2020 to 2050 were generated based on two growth scenarios, which were assessed in comparison to the\xa0Reference\xa0Scenario', '\nScenario 1: In this scenario, the clinker-to-cement ratio is 0.61. This corresponds to an adoption of alternative cements equivalent to 39 percent,\xa0and the mitigation result equates to 8 gigatons of carbon dioxide abated by 2050', 'Scenario 2: In this scenario, the clinker-to-cement ratio is 0.46. This corresponds to an adoption of alternative cements equal to 54 percent,\xa0and the mitigation result equates to 16 gigatons of carbon dioxide abated by 2050', '\nFinancial Model\nThe cumulative first cost of implementing the alternative cement solution over the period 2020-2050 is approximately US$5055 billion under the Scenario 2.[1] \xa0Yet the marginal first cost of alternative cements as compared to traditional ordinary portland cement concrete is US$63.5 billion. Cost data for both conventional and solution technologies are collected from cement suppliers and peer-reviewed literature', 'Results\nThe Scenario 1 results show a mitigation impact of 8 gigatons of carbon dioxide-equivalent emissions over the period 2020–2050.\xa0 The Scenario 2 shows a mitigation impact of 16 gigatons of carbon dioxide-equivalent emissions over the same period', 'Discussion\nThe current study takes considers a variety of alternative cementitious materials which can reduce the clinker to cement ratio. This reduction amount is based upon international standards of cement production and includes cement types CEM II–CEM V. CEM III and CEM IV are typically used in specialties construction applications and were weighted based upon their base year adoption levels (combined to be about 10 percent). CEM II and CEM V see increased adoption to nearly 90 percent\xa0of the market, displacing all market share of CEM I (traditional OPC system) in 2050 by any of the scenarios. Because the model is not bounded by the availability of alternative binding materials, high adoption of the solution is feasible. It is expected the fly ash and slag, industrial by-products, will diminish in supply as coal power and virgin steel production decreases—a situation already being realized on the West Coast of the United States. Other alternative materials, such as calcined clays, limestone, and natural pozzolanic materials, will replace fly ash and slag. The current study for this solution does not take into account the gradual reabsorption of carbon dioxide by cementitious materials, which have the potential to recover up to 17 percent of their initial manufacturing, or cradle-to-gate, emissions (Souto-Martinez et al., 2018). Due to the pervasiveness of concrete as a construction material around the world, it was estimated that nearly 18.5 gigatons of carbon dioxide emissions were sequestered over the period 1930-2013, thereby reducing the net greenhouse impact of cement (Xi et al., 2016). Alternative cements does not account for this carbonation, since the carbon uptake of existing concrete systems will occur regardless of the adoption of alternative cements. Additionally, alternative cements do not have the same ability as traditional OPC to sequester carbon dioxide due to different chemistries (less than 10% of initial emissions). Vulnerability of concrete structures to the corrosive effects of global warming and sea level rise (Saha & Eckelman, 2014) might create more demand for cement in the coming decades; this, too, was not considered in either the Reference Scenario or adoption forecasts', '\xa0\n\n\n[1] All monetary values are presented in 2014 US$.']"
2,Alternative Refrigerants,"['Project Drawdown defines alternative refrigerants as\xa0the gradual replacement of hydrofluorocarbons (HFCs) used in a variety of applications by alternative refrigerants with significantly lower global warming potential (GWP), including ammonia, carbon dioxide, propane, and isobutane.\xa0\nRefrigerants are used as working fluid in commercial refrigeration systems;\xa0in household appliances such as air conditioners and refrigerators;\xa0in refrigerated containers used for carrying perishable goods;\xa0as air conditioning systems onboard cars, trains, aircrafts, and ships;\xa0and in industrial cooling systems, etc. There are various classes of refrigerants.[1] Chlorofluorocarbons (CFCs) are ozone-depleting substances and have been phased out under the Montreal Protocol; hydrochlorofluorocarbons (HCFCs) are also being phased out. HFCs, which do not deplete ozone, emerged as an alternative to HCFCs and have grown to extensive use. All refrigerants have a high GWP, and their release into the environment contributes to global warming. Considering the large impact that\xa0the release of refrigerants has on global warming, world leaders have agreed to phase out HFCs and replace them with natural refrigerants with much less warming potential under the Kigali Accord of\xa0October\xa02016. Refrigerants are emitted into the environment during the production process, from refrigerant banks[2] due to leakages, and during end-of-life disposal of appliances', 'Methodology\nMeasuring the alternative refrigerants solution requires: generating a total addressable market forecast of HFC refrigerant gas emissions for the period 2020–2050 (in kilotons of carbon dioxide-equivalent emissions per year), forecasting an adoption of replacement refrigerants and the resulting decreased emissions from reducing the amount of HFC produces, used, and released into\xa0the atmosphere for each year from 2020 to 2050, and then comparing the difference in emissions from the total market and the adoption scenarios to arrive at the results.\xa0\nEmissions from refrigerants can be reduced in five main ways:\n(i)\xa0 \xa0 \xa0 \xa0 \xa0lower\xa0the demand/use of appliances and thereby production of refrigerants\n(ii)\xa0 \xa0 \xa0 \xa0 replace\xa0refrigerants with low-warming HFCs/new cooling agents/non-HFC substances\n(iii)\xa0\xa0\xa0\xa0\xa0\xa0 Increase\xa0the refrigeration efficiency in appliances, thereby lowering the use of refrigerants\n(iv)\xa0 \xa0 \xa0 \xa0control\xa0leakages of refrigerants from existing appliances by good management practices\n(v)\xa0 \xa0 \xa0 \xa0 ensure\xa0recovery, reclaiming/recycling, and destruction of refrigerants at end of life', 'This Project Drawdown solution models the second option', 'Total Addressable Market\nThe model uses available projections for global HFC emissions across various subsectors, such as commercial, industrial, domestic, and stationary (as opposed to mobile) AC systems. Velders (2015, 2017, 2019) provides refrigerant emissions (measured in kton refrigerant – HFCs).\xa0Velders provides an\xa0upper scenario and a lower scenario. A mean scenario is also calculated.\xa0These forecasts are pre–Kigali Accord and show a steadily increasing HFC emissions profile through 2050.\xa0These scenarios become the total addressable market for the alternative refrigerants model.\xa0\nAdoption of alternative refrigerants is modeled using forecasts from the literature', 'Adoption Scenarios\nVelders and others estimate the adoption of alternative refrigerants correlated with two different shared socioeconomic pathways (SSPs) developed by the International Institute for Applied Systems Analysis (IIASA).\xa0The literature presents a low scenario and a high scenario.\xa0A mean scenario is also calculated.\xa0These three scenarios—low, mean and high—determine the PDS 1, PDS 2, and PDS 3 adoption scenarios. These were assessed in comparison to a Reference scenario, in which the solution’s market share was fixed at the current levels', 'Emissions Model\nIn the reference case, HFC emissions are prognosticated according to the year-over-year data provided in the literature.\xa0 Whereas the exact mix of alternative refrigerants is not determined, the average GWP of 10 is used.\xa0This is much lower than the dynamic GWP of HFCs, which nears an average GWP of 2000', 'Results\nThe total carbon dioxide-equivalent reductions that can be achieved from 2020 to 2050 in the Scenario 1 are 43.5 gigatons. Scenario 2 shows a larger reduction of 50.5 gigatons from 2020 to 2050', 'Discussion\nIndirect emissions from powering refrigeration appliances is a significant component of grid emissions and is expected to increase in a warming world.\xa0Adoption of low-GWP HFC replacements with new appliances brings the potential for increases in energy efficiency.\xa0Some have estimated that the potential impact on indirect emissions may be half as much or as great as direct emissions reduction.\xa0At this time this model and report do\xa0not include a forecast for indirect emissions reduction', 'In order to achieve a global phase-down of HFCs, replacement fluids must be identified\xa0and a global refrigerant transition must be implemented. Currently, there is no single replacement fluid, and all replacements include trade-offs. The theoretically ideal refrigerant is the one that has\xa0zero ozone depletion potential (ODP) and\xa0low GWP,\xa0is nontoxic and\xa0nonflammable, has appropriate thermodynamic and heat transfer properties, and is compatible with any type of lubricating oil (El-Sayed, El Morsi, and Mahmoud 2018). Hydrocarbons (HCs) satisfy all the requirements except that they are highly flammable oil (El-Sayed, El Morsi, and Mahmoud 2018)', 'Climate-friendly alternatives to HFCs are increasingly available for most uses and fall into two basic categories: “natural” or nonfluorinated substances with low GWPs, and fluorinated substances with low to mid-range GWPs (Borgford-Parnell et al., 2018). Currently\xa0there is an emphasis on ""natural refrigerants"" that are gradually being used as a replacement for refrigerants from the hydrofluorocarbon group (Zanchi, Boban, and Soldo 2019). Commercially available\xa0 natural refrigerants\xa0include: ammonia (R-717), with a GWP of near zero; hydrocarbons (HC )(e.g., propane [R-290] and isobutene [R-600a]), with GWPs of less than 4; and carbon dioxide\xa0(R-744)\xa0 (with a GWP of 1). The use of hydrocarbons (e.g., isobutane and propane ammonia and carbon dioxide)', 'Commercially available fluorinated substances include O2, the low-GWP HFCs, also known as hydrofluoro-olefins (HFOs), some with GWPs of less than 1, according to the IPCC. Other alternatives include, HFC-32, with a GWP of 677, and HFC-152a, with a GWP of 138, according to the IPCC. There are also “not-in-kind” alternatives that do not involve refrigerants, such as district cooling\n\n\n\n[1] Such as Chlorofluorocarbons (CFCs) like R-11, R-12, and R-502; Hydrochlorofluorocarbons (HCFCs) like R-22; Hydrofluorocarbons (HFCs) such as R404A, R134a, and R 407; and natural refrigerants like CO2 and NH3', '\n\n[2] The total quantity of refrigerant gases in existing equipment.']"
