,title,paragraphs
18,Distributed Solar Photovoltaics,"['Project Drawdown defines as distributed solar photovoltaic (PV), systems that typically are sited on rooftops, that include both residential solar PV and community-scale solar PV systems with under 1 megawatt of capacity. This solution replaces conventional electricity-generating technologies such as coal, oil, and natural gas power plants', 'In a PV system, sunlight falling on a solar cell produces electricity as a result of the phenomenon of the photoelectric effect. The solar cells deployed in such systems are typically divided into three generations. The first-generation solar cells, which presently capture the majority of the\xa0 market, are based on crystalline silicon (Si) - either single crystalline or multi-crystalline. The second-generation solar cells are thin-film solar PV cells, which are again of three types, i.e.\xa0 a) amorphous\xa0 and micromorph silicon; b) cadmium telluride; and c) copper-indium-selenide and copper-indium-gallium-diselenide. Third-generation solar cells, such as high concentration PV cells, dye sensitized solar cells, and organic solar cells, are still under development and are not yet\xa0 fully commercialized', 'Most adoption scenarios of this technology earlier predicted only a low, single-digit percentage of total electricity to be generated by all SPV (including both rooftop as well as utility scale) by 2050; but in view of the rapid recent adoption of this technology in many countries,\xa0 the scenarios have also raised their levels of ambition. In fact some recent scenarios have even predicted that almost 60% of global electricity generation would come from solar PV by 2050. Such increased projections are largely based on increasing solar cell efficiencies and rapidly declining costs for PV systems, thus making them competitive with conventional generating sources in many parts of the world', 'Methodology\nTo capture the appropriate level of agency, the solar PV market was split between distributed solar photovoltaics (representing households and building owners) and utility-scale solar photovoltaics. This analysis models distributed solar PV systems with under 1 megawatt of capacity', 'Total Addressable Market[1]\nTwo total addressable markets were developed for this sector solutions, supported on lower and higher climate emissions mitigation targets linked to different levels of electricity demand and renewable energy sources integration. For distributed solar photovoltaics it is based on projected global electricity generation in terawatt-hours from 2020-2050, with current adoption[2] estimated at 0.7 percent (183 terawatt-hours) of generation. With no definitive estimation of the type of future solar PV adoption, it is assumed that distributed PV installations represent around 40 percent of the market, with utility-scale solar capturing the remaining 60 percent (US DOE, 2012; IEA, 2014; SEIA, 2014)', 'Adoption Scenarios[3]\nImpacts of increased adoption of distributed solar PV from 2020-2050 were generated based on two growth scenarios, which were assessed in comparison to a\xa0Reference\xa0Scenario where the solution’s market share was fixed at the current levels', '\nScenario 1: This scenario is based on the evaluation of yearly averages of five optimistic scenarios: IEA (2017) Energy Technology Perspectives 2DS and B2DS scenarios; IEA (2018) World Energy Outlook SDS; IRENA (2018c) REmap Case scenario; and Grantham Institute and Carbon Tracker (2017) Strong PV Scenario using, a high growth trajectory', 'Scenario 2: This scenario is based on the yearly average values of three 100% RES scenarios of electricity generation by 2050, being Greenpeace (2015) Advanced Energy [R]evolution Scenario; Ram et al. (2019) scenario and Ecofys (2018) 1.5°C scenario. These scenarios represent very ambitious pathway towards a fully decarbonized energy system in 2050', '\nFinancial Model\nBased on a meta-analysis of the data collected of these systems installation costs around the world, it is assumed total first cost of US$2,012 per kilowatt.[4] A customized learning rate of 19.5 percent was developed, accounting for independent impact on PV modules and balance of systems; this has the effect of reducing the installation cost to US$653 per kilowatt in 2030 and to US$462 in 2050, compared to US$1,786 per kilowatt for the conventional technologies (i.e. coal, natural gas, and oil power plants). An average capacity factor of 19 percent is used for the solution, compared to 57 percent for conventional technologies. Fixed operation and maintenance costs of US$21.8 per kilowatt are considered for distributed solar photovoltaic systems, compared to US$34.7 per kilowatt for the conventional technologies', 'Integration[5]\nThrough the process of integrating distributed solar PV with other solutions, the total addressable markets were adjusted to account for reduced demand resulting from the growth of more energy-efficient technologies,[6] as well as increased electrification from other solutions like electric cars and high-speed rail. Grid emissions factors were calculated based on the annual mix of different electricity generating technologies over time. Emissions factors for each technology were determined through a meta-analysis of multiple sources, accounting for direct and indirect emissions', 'Results\nComparing the results from the two modeled scenarios to the Reference Scenario allows us to estimate the climate and financial impacts of increased adoption of distributed solar PV systems. The Scenario 1 projects 13.5 percent of total electricity generation worldwide from distributed solar PV by 2050 (i.e. 6,235 terawatt-hours). In the Scenario 2, the market share of this solution reaches 14.24 percent(i.e. 10,106 terawatt-hours) under a higher total addressable market', 'The climate and financial impacts for the accelerated adoption of distributed solar PV are both significant. The Scenario 1 results in the avoidance of 28.0. gigatons of carbon dioxide-equivalent greenhouse gas emissions from 2020-2050, with US$479.6 billion in associated marginal first costs. Nearly US$7.9 trillion of lifetime operating savings are projected. The Scenario 2 is more ambitious in the growth of distributed solar PV \xa0technologies, with impacts on greenhouse gas emission reductions over 2020-2050 of 68.64 gigatons associated with over US$13.5 trillion of lifetime savings', 'Discussion\nSolar has an incredibly promising long-term potential, as solar resources are plentiful and widespread and future advances in both battery and PV technologies should continue to drive the adoption of this technology, even in a world without specific policy interventions. Based on the financial impacts alone, it is clear that global adoption of rooftop solar is economically viable and will provide a significant return on investment. Rapid adoption will also contribute substantially to global greenhouse gas abatement', 'Nevertheless, the massive adoption of rooftop solar requires several issues to be contended with. It must be noted though that sunlight is intermittent, and electricity profiles from solar PV do not always match well with the typical demand profile of electricity consumers. This means that PV often must be installed alongside dispatchable sources such as coal and natural gas. Alternatively, solar PV can be installed with an energy storage system so that solar electricity generated during the day can be stored for use during the hours when the sun is not shining. Also, there will need to be more demand flexibility, to change the demand profile to better match the generation profile. There may also be materials constraints on the expansion of production capacity for current PV technology, for several critical materials are only mined as by-products of other metals and could be limited in their ability to meet the levels of production needed for significant global adoption. More research into materials reduction in PV systems design will help address this issue', '\xa0\n\n[1] For more about the Total Addressable Market for the Electricity Generation Sector, click the Sector Summary: Electricity Generation Sector link below', '[2] Current adoption is defined as the amount of functional demand (i.e. TWh) supplied by the solution in 2018', '[3] To learn more about Project Drawdown’s two adoption scenarios, click the Scenarios link below. For information on Electricity Generation Sector-specific scenarios, click the Sector Summary: Electricity Generation link', '[4] All monetary values are presented in US2014$', '[5] For more on Project Drawdown’s Electricity Generation Sector integration model, click the Sector Summary: Electricity Generation link below', '[6] For example: LED lighting and high efficiency heat pumps.']"
19,District Heating,"['Project Drawdown defines district heating as\xa0a centralized renewably-powered heating system and the distribution of generated heat to the buildings of a defined community, through a network of insulated buried pipes, to satisfy the demand for space heating. District heating replaces the conventional practice of heating indoor spaces individually, with heat generated on-site. Combining heating loads into larger totals allows for the installation of more efficient boilers which are often only available or cost-effective in larger sizes. Powering renewable district heating systems is possible with biomass, solar, and geothermal energy as well as waste heat enabling economies of scope', 'District heating systems require a minimum heat load per linear unit of network to make them financially feasible and provide them an advantage over using on-site space heating systems. The density of the demand area and average yearly temperature dictate the heat load density in an area. In order for typical district heating (nonrenewable) to be commercially viable, there is a need for a minimum of 2 megawatt-hours per meter of planned network length. As a result, district heating systems have been implemented mainly in urban areas with higher population density, located at cooler climate zones (with mostly fossil-powered systems in Northern Europe, China, and Russia). District heating is a mature technology, with most systems currently using fossil fuels to generate heat', 'Methodology\nThis analysis focuses on the district heating systems that provide an alternative to conventional on-site heating by offering efficiencies through scale, replacing current systems’ fuel with renewable energy sources, and offering environmental benefits through decreased greenhouse gas emissions', 'Total Addressable Market[1]\nThe total addressable market for district heating systems using renewable energy sources is based on estimated supply for commercial and residential building space-heating in terawatt-hours from 2020 to 2050, derived from International Energy Agency\xa0(IEA) data', 'Current adoption of district heating from renewable sources represents around 10 percent of total district heating systems (at least 150 terawatt-hours). Future adoption is focused on increasing the number of renewably-powered systems to meet demand, but also on using on-site heat exchangers instead of boilers and furnaces', 'Adoption Scenarios[2]\nThe impacts of increased adoption of district heating from 2020 to 2050 were generated based on two growth scenarios, which were assessed in comparison to a Reference Scenario where the solution’s market share was fixed at the current levels. In each case, the global availability of biomass and geothermal to power these systems was analyzed collectively across all Project Drawdown solutions to ensure that there was sufficient renewable power', '\nScenario 1: This scenario follows a district heating adoption trajectory from IEA ETP 2DS (2017) with an increasing share of zero-emissions sources until 100% of district heating is renewably-powered by 2060. \xa0\nScenario 2: This scenario follows an adoption trajectory from IEA ETP Beyond 2DS (2017) with an increasing share of zero-emissions sources until 100% of district heating is renewably powered by 2050.\xa0\n\nEmissions Model\nEmissions from the conventional alternative included fuel and electrical grid emissions from localized heating systems based on global average final heating demand. Solution emissions (renewable district heating) were assumed 0. We exclude any indirect emissions from say, facility construction, due to limited availability of data and expected customized facilities for the localities of installation due to their unique availability of renewable energy sources. Emissions factors came from the Intergovernmental Panel on Climate Change (IPCC) data', 'Financial Model\nThe financial inputs used in the model assume an average installation cost of US$1,796 per kilowatt,[3] determined through a variable meta-analysis (the conventional cost is US$198 per kilowatt). Due to the technology maturity, a learning rate of 2 percent was used, similar to the one applied to the conventional technologies the solution is replacing. An average lifetime of 24 years was used for the solution, compared with\xa019 years for the conventional', 'Integration[4]\nThe district heating solution was integrated with others in the Buildings Sector by first prioritizing all solutions according to the point of impact on building energy usage. This meant that building envelope solutions like Insulation were first, building systems like BAS were second, and building applications like Heat Pumps were last.[5] The impact on building energy demand was calculated for highest-priority solutions, and energy-related district heating input values were reduced to represent the impact of higher building envelope solutions', 'Results\nIncreasing the use of renewable district heating from approximately 1.6 percent in 2018 to 13 percent of building space heat supply by 2050 would require an estimated US$227\xa0billion in net first costs. These results for Scenario 1 show that savings would amount to US$1.6 trillion over the technology lifetime and 6.3 gigatons of carbon dioxide-equivalents over 2020–2050. Under Scenario 2, this solution could reduce 9.9 gigatons of carbon dioxide-equivalent emissions from 2020 to 2050 and US$2.4 trillion for a net cost of US$337\xa0billion to get adoption to 20%', 'Discussion\nThe main advantages of district heating are twofold. First, the systems are highly flexible: it is much easier to impact ten buildings if they are on a common distribution loop than by trying to negotiate with each of the individual buildings to install efficient renewable technology at each of the buildings. Second, district heating employs economies of scale and economies of scope to install preferred technologies prior to achieving cost-effectiveness at the individual building scale', 'Limitations\nThe adoption path for district heating is influenced by different factors:\n\nhigh heat load density – because the heat network is capital-intensive, the heated area should have a high density to minimize the required pipe length\neconomic viability – the district heating system is economically viable only if the total heat requirement of the entire system exceeds a minimum level\nlocation of buildings – to minimize connection length, buildings should be within the minimum proximity of the existing heat network, resulting in lower investment and operational costs\nlocation of heat source – by locating the heat source close to or within the urban areas, the total length of heat network can be minimized', '\nIn some areas of the world (such as the United States and Europe), the existing drinking water and sewage infrastructure has reached the end of its lifetime. If replacing those piping networks can be coordinated with installing new district heating piping networks, the cost of the systems could be significantly reduced. In areas where new district heating systems can be installed at the same time as they are building new buildings, the cost of piping can in some cases be cut in half by utilizing radiant heating systems to distribute the heat inside the buildings, significantly decreasing first costs', 'Some of the first targets for conversion to renewable district heating systems should be fossil-based district heating systems, which are numerous in China and Russia. These systems, particularly those in China, are also often rather inefficient and result in significant emissions and local pollution. Converting these to renewables can have climate, financial, and health benefits for residents in those countries. Several other systems in Europe can also be upgraded to meet the low emissions standards of the leaders in Scandinavia', 'Note: August 2021 corrections appear in\xa0boldface', '\n\n[1] For more on the Total Addressable Market for the Buildings Sector, click the Sector Summary: Buildings link below', '\n\n[2] To learn more about Project Drawdown’s growth scenarios, click the Scenarios link below. For information on Buildings Sector-specific scenarios, click the Sector Summary: Buildings link', '\n\n[3] All the costs presented are in US2014$', '\n\n[4] For more on Project Drawdown’s Buildings Sector integration model, click the Sector Summary: Buildings link below', '\n\n[5] Although we used the term “priority”, we do not mean to say that any solution was of greater importance than any other, but rather that for estimating total impact of all building solutions, we simply applied the impacts of some solutions before others, and used the output energy demand after application of a higher-priority solution as the energy demand input to a lower-priority solution.']"
20,Dynamic Glass,"['Project Drawdown defines dynamic glass or smart glass as\xa0glass that dynamically changes its opacity to reduce or increase the amount of light and heat that is allowed to pass through. This technology replaces high-performance static glass that’s already prevalent in commercial buildings in the Organisation for Economic Cooperation and Development (OECD)', 'Dynamic glass promises energy savings for both thermal and lighting systems in buildings and transportation, though we focus only on architectural applications. Applications include sunlight regulation in buildings and glare reduction on rearview mirrors. There are many technologies that allow this, including those that automatically change in response to light, heat, or an electrical current (that is, by human control). Dynamic glass can greatly reduce the inefficiency of building windows and other glazed surfaces and can also eliminate the need for shading, resulting in an increase in natural lighting in buildings. In this report, we examine the potential financial and climate impact of increased adoption of dynamic glass instead of high-performance static glass for commercial building applications', 'Methodology\nTotal Addressable Market\nThe total addressable market (TAM) for dynamic glass was calculated using the Project Drawdown integrated buildings TAM model, which collectively calculates the TAMs of building floor area, roof area, space heating and cooling, and all other floor-area driven TAMs used in the building sector. The estimated areas are also subdivided by building type (residential and commercial), and by building climate zone[1]. This model used numerous sources. The total addressable market for commercial architectural glass was determined based on the estimated growth in commercial floor area from this model and the average commercial window-to-floor-area ratio from several sources. Recent sales data of dynamic glass from four market research sources was used to estimate the solution’s current adoption[2] in square meters of glass installed (2.48 million) and in square meters of commercial floor area adopted\xa0(42 million)', 'Adoption Scenarios\nImpacts of increased adoption of dynamic glass from 2020 to 2050 were generated based on two growth scenarios, which were assessed in comparison to a\xa0Reference\xa0Scenario where the solution’s market share was fixed at the current levels', ""For dynamic glass, scenarios were developed based on near-term projections and long-term targets from international organizations:\n\nScenario 1: For near-term forecasts to 2022, historical and trend data estimated by Navigant Research (2012) were\xa0used\xa0and interpolated with a far future forecast guided by the World\xa0Green Buildings Council's target of 100 percent net zero buildings by 2050.[3] A more conservative number of 30 percent adoption in 2050 was chosen"", '\n\nScenario 2: The same procedure was performed as in the Scenario 1, but 50 percent adoption in 2050 was used', '\nEmissions Model\nLighting, heating, and cooling energy data for commercial buildings were\xa0obtained from several sources and weighted by climate zone where possible. Energy efficiency of lighting, heating, and cooling were all found to be between 7 and 9 percent. Electricity and fuel consumption were included, and emissions factors were based on the Intergovernmental Panel on Climate Change (IPCC) data', 'Financial Model\nFirst costs of dynamic glass are around three times those of conventional glass based on over 20 sources, but a learning rate of 8 percent was applied for dynamic glass.[4] As the technology is still relatively new, and as some types of dynamic glass do use small amounts of electricity whereas others do not, operating costs of the glass itself were not included. Cooling, heating, and lighting costs however, were included for commercial areas with dynamic glass adoption and those with conventional glass adoption', 'Integration\nThe dynamic glass solution was integrated with others in the Buildings Sector by first prioritizing all solutions according to the point of impact on building energy usage. This meant that building envelope solutions like insulation were first, building systems like building automation systems\xa0were second, and building applications like heat pumps were last.[5] The impact on building energy demand was calculated for highest-priority solutions, and the dynamic glass input value was reduced to represent the impact of higher building envelope solutions. The output from the dynamic glass model was used as the input in lower-priority solutions', 'Results\nScenario 1 forecasts that just over 200 million square meters of dynamic glass could be installed by 2050, thereby avoiding 0.3 gigatons of carbon dioxide-equivalent greenhouse gas emissions compared to high performance static glass. The marginal capital cost compared to the Reference Scenario would be US$69 billion, which assumes that conventional glass is purchased in the Reference Scenario,[6] but this scenario saves US$99 billion in operating costs over glass lifetimes due to reduced energy consumption', 'Scenario 2 of growth to 341 million square meters of glass shows 0.5 gigatons of emissions reduced and US$165 billion in lifetime savings at a cost of US$103 billion', 'Discussion\nIt is clear that dynamic glass can help commercial buildings reduce their emissions and save operating expenses, though the costs would be significant. For buildings going through a retrofit anyway, it could be financially viable to have dynamic windows installed instead of static high-performance windows. For buildings that do not need any other retrofit, the business case for retrofitting high-performance windows with dynamic windows (as opposed to staying with existing high-performance windows) may be weak. Some aspects that may affect this result have not been examined, however, such as the regional nature of adoption due to dynamic glass’s high price and weather application. Realistically, architectural dynamic glass will be mainly adopted in wealthier regions with higher average temperatures, such as Australia and the southern and western areas of the US. Additionally, there are likely some residential applications that would increase the impact of dynamic glass', 'The high up-front cost of dynamic glass has inhibited its growth. As new competitors enter the market (including for transportation applications of dynamic glass, which were not included in our model), the price of dynamic glass is expected to drop, and adoption is expected to accelerate. Growth could be further driven with government support and the development of programs that demonstrate the benefits of dynamic glass to consumers. It’s important to note, though, that for some areas and applications that still use plain glass (that is, non-high-performing), a large portion of the benefits of dynamic glass can be obtained with mature technologies that are considered high performance static that are mostly cheaper. This is examined in another model', '\n\n\n[1] We were guided by the ASHRAE 169 building climate zone standards', '\n\n[2] Current adoption is defined as the amount of functional demand supplied by the solution in 2018. This study uses 2014 as the base year', '\n\n[3] All buildings consume net zero energy / produce onsite or produce net zero carbon emissions', '\n\n[4] Although no learning rate data were\xa0found on dynamic glass, another cooling technology (air-conditioning units) had a learning rate of 13 percent, so a rate was used that was bounded by this', '\n\n[5] Although we used the term “priority,”\xa0we do not mean to say that any solution was of greater importance than any other, but rather that for estimating total impact of all building solutions, we simply applied the impacts of some solutions before others, and used the output energy demand after application of a higher-priority solution as the energy demand input to a lower-priority solution', '\n\n[6] All costs are presented in 2014 US$.']"
