,title,paragraphs
39,Improved Rice Production,"['Project Drawdown defines improved rice production as: a set of practices to reduce methane emissions from paddy rice production using alternate wet and dry periods and other strategies. This solution replaces conventional paddy rice production in mechanized (non-smallholder) regions', 'Paddy rice farming is a major source of greenhouse gas emissions largely in the form of methane, as flooded rice paddies provide a suitable anaerobic environment for methanogenesis. Yet, rice is a world staple crop of extreme importance, particularly in Asia. Thus, low-methane rice production techniques are sorely needed. Drawdown investigated two categories of low-methane rice production: improved rice production (profiled here), with techniques suitable to both small- and large-scale operations, and System of Rice Intensification, currently limited to the smallholder context', 'Improved rice production practices include: changes to water management (alternate wetting and drying); fertility management; use of aerobic cultivars; no-tillage; and direct seeding. Data was collected only from studies that used two or more of these practices', 'Methodology\nTotal Land Area[1]\nTotal available land is 111 million hectares, representing non-smallholder rice production.[2] Current adoption[3] of improved rice cultivation is estimated at 41 million hectares, by interpolating the global area under ""Direct Seeded Rice"" in the year 1997 and 2018.', 'Adoption Scenarios[4]\nFive custom adoption scenarios were developed based on the estimation of low, medium, and high adoption rates based on the historical growth of direct seeded rice and water management available in the literature. Some of these scenarios include early peak adoption of the solution by 2030', 'Impacts of increased adoption of improved rice production from 2020-2050 were generated based on two growth scenarios, which were assessed in comparison to a\xa0Reference\xa0Scenario where the solution’s market share was fixed at the current levels', '\nScenario 1: This scenario estimates the practice of improved rice cultivation on 94 million hectares by 2050', 'Scenario 2: Based on the most aggressive and early-peak-adoption custom scenarios, this scenario yields adoption of the solution on 111 million hectares', ""\nAdoption of the solution not only mitigates greenhouse gas emissions, but also saves significant amounts of irrigation water used in rice cultivation. As a reflection of improved rice cultivation's many benefits, aggressive adoption of the solution is projected"", 'Emissions, Sequestration, and Yield Model\nMethane emissions reduction from improved rice cultivation is set at 5.3 tons of carbon dioxide-equivalent per hectare per year, based on 106data points from 16 sources. Nitrous oxide emissions reduction is calculated at -1.4 tons of carbon dioxide-equivalent per hectare per year, based on 43 data points from 42 sources (some sources included meta-analysis of country of level data). Sequestration rates are set at 1.45 tons of carbon per hectare per year, based on 25 data points from 3 sources', 'Yield gain compared to business-as-usual annual cropping were set at 4.5 percent, based on meta-analysis of 78 data points from 11 sources', 'Financial Model\nFirst costs of improved rice cultivation are US$0 per hectare, as the practices use existing equipment and infrastructure.2 For all agricultural solutions, it is assumed that there is no conventional first cost, as agriculture is already in place on the land. Net profit is calculated at US$640.07per hectare per year for the solution (based on meta-analysis of 16 data points from 6 sources), compared to US$449.16 per year for the conventional practice (based on 33 data points from 16 sources). While the operational cost is calculated at US$384.35 per hectare per year for the solution (based on 12 data points from 5 sources), compared to US$655.86 per year for the conventional practice (based on the 28 data points from 13 sources)', 'Integration[5]\nDrawdown’s Agro-Ecological Zone model allocates current and projected adoption of solutions to the planet’s forest, grassland, rainfed cropland, and irrigated cropland areas. Adoption of improved rice cultivation was the second-highest priority for cropland, following System of Rice Intensification', 'Results\nTotal adoption in the Scenario 1 is 94 million hectares in 2050, representing 84 percent of the total suitable land. Of this, 52.9 million hectares are adopted from 2020-2050. The emissions impact of this scenario is 9.44 gigatons of carbon dioxide-equivalent by 2050. Net cost is US$0. Lifetime savings in net profit is US$224.7billion and operational cost is US$462.8 billion. Yield gain results in an additional yield of 56 million metric tons between 2020 and 2050', 'Total adoption in the Scenario 2 is 111 million hectares in 2050, representing 100 percent of the total suitable land. Of this, 70.3million hectares are adopted from 2020-2050. The impact of this scenario is 13.82 gigatons of carbon dioxide-equivalent by 2050. . Net cost is US$0. Lifetime saving in net profit is US$304.5 billion and operational cost is US$623.4. Yield gains result in an additional yield of 83 million metric tons of rice between 2020-2050', ""Discussion\nBenchmarks \nThe Intergovernmental Panel on Climate Change (Smith et al, 2007) estimates emissions reduction of 0.2 gigatons carbon dioxide-equivalent per year by 2030 for rice management. Griscom et al (2017)’s “Natural climate solutions” calculate 0.08-0.26 gigatons of carbon dioxide equivalent per year in 2030. Between the two Scenarios, Drawdown's two rice solutions combined provide 0.34-0.54 gigatons carbon dioxide-equivalent per year by 2030. Our results are likely higher due to the inclusion of carbon sequestration benefits. (Limitations\nIt would be useful to obtain more rice production financial data points for the conventional case. Additional data on current and projected adoption would be useful as well"", 'Conclusions\nRice is a staple crop of critical importance, particularly in Asia. Rice production is currently a major contributor of methane emissions. Fortunately, low-methane rice production systems are ready to be scaled up. Wide adoption of these practices can have a significant impact on climate change mitigation', '\xa0\n\n\n[1] To learn more about the Total Land Area for the Food Sector, click the Sector Summary: Food link below', '\n\n[2] Determining the total available land for a solution is a two-part process. The technical potential is based on the suitability of climate, soils, and slopes, and on degraded or non-degraded status. In the second stage, land is allocated using the Drawdown Agro-Ecological Zone model, based on priorities for each class of land. The total land allocated for each solution is capped at the solution’s maximum adoption in the Optimum Scenario. Thus, in most cases the total available land is less than the technical potential', '\n\n[3] Current adoption is defined as the amount of functional demand supplied by the solution in the base year of study. This study uses 2014 as the base year due to the availability of global adoption data for all Project Drawdown solutions evaluated', '\n\n[4] To learn more about Project Drawdown’s three growth scenarios, click the Scenarios link below. For information on Land Use Sector-specific scenarios, click the Sector Summary: Food link', '\n\n[5] For more on Project Drawdown’s Food Sector integration model, click the Sector Summary: Food link below.']"
40,Indigenous Peoples’ Forest Tenure,"['Project Drawdown defines indigenous peoples’ forest tenure as\xa0providing indigenous communities with secure legal tenure rights to their traditional forest land. This practice replaces non-degraded forest without such tenure. \xa0\nUnder indigenous peoples’ forest tenure, deforestation and emissions are significantly reduced, with deforestation and degradation rates significantly lower than the global average. Indigenous peoples have claim to large tracts of forest land around the world, and the current global trend is that indigenous peoples’ legal forest tenure is on the rise', 'Granting indigenous peoples and local communities secure tenure to manage their lands thus results in carbon benefits in the form of reduced emissions from deforestation and continued carbon sequestration. It can be seen as a form of productive forest protection, given sustainable management and utilization of forest products', 'The indigenous peoples’ forest tenure solution has highly desirable human rights co-benefits, leading Project Drawdown to prioritize it for forest lands wherever possible', 'Methodology\nTotal Land Area\nThe maximum area allocated for indigenous peoples’ forest tenure is 1155 million hectares, which represents the projected future nondegraded, nonprotected area available for protection.[1] Current adoption[2] of the solution is 497 million hectares, representing forest land managed by indigenous peoples with secure tenure', 'Adoption Scenarios\nA total of 1155 million hectares of nondegraded forest area was allocated to this solution. Adoption projections are linear trends based on the indigenous peoples’ managed area in low- and middle-income countries given for the year 2002, 2008, 2013, and targeted percentage for the year 2030 by Rights and Resources 2018 publication[3]. Six custom adoption scenarios were developed for indigenous peoples’ forest tenure. All begin with current adoption of 497 million hectares', 'Impacts of increased adoption of indigenous peoples’ forest tenure from 2020 to 2050 were generated based on two growth scenarios. These\xa0were assessed in comparison with\xa0a\xa0Reference\xa0Scenario, in which\xa0the solution’s market share was fixed at the current levels', '\nScenario 1: The conservative approach of this scenario yields an increase in area from 512.60 million hectares in 2013 to 995.5 million hectares by 2050', 'Scenario 2: Under the aggressive adoption of this scenario, the indigenously managed area increases to 1141.4 million hectares by 2050', '\nThe continuous annual rate of forest degradation, which is 0.47 percent per annum, limits the 100 percent adoption of the total available land area for this solution, even under the most aggressive adoption scenarios', 'Emissions Model\nAvoided emissions from indigenous peoples’ forest tenure are set at 281.1 metric tons of carbon dioxide-equivalent per hectare, based on meta-analysis of 20 data points from six\xa0sources', 'Financial Model \nIt is assumed that any costs of indigenous peoples’ forest tenure (e.g., carbon payments or payment for ecosystem services) are borne at a government or nongovernmental organization (NGO) level. Project Drawdown land solutions only model costs that are incurred at the landowner or manager level', 'Integration\nProject Drawdown’s Agro-Ecological Zone model allocates current and projected adoption of solutions to the planet’s forest, grassland, rainfed cropland, and irrigated cropland areas. Indigenous peoples’ forest tenure was the third priority for use of nondegraded forest, following peatlands\xa0and mangrove protection within the coastal wetland protection\xa0solution', 'Results\nTotal adoption in the Scenario 1 is 995.5 million hectares in 2050, representing 86 percent of the total available land. Of this, 498.6 million hectares are adopted from 2020 to 2050. The emissions impact of this scenario is 8.69 gigatons of carbon dioxide-equivalent greenhouse gases reduced or sequestered by 2050. Total carbon stock protected is 686.9gigatons of carbon dioxide-equivalent. Financial impacts are not modeled', 'Total adoption in the Scenario 2 is 1141.4 million hectares in 2050, representing 99 percent of the total available land. Of this, 644.6 million hectares are adopted from 2020 to 2050. The impact of this scenario is 12.93 gigatons of carbon dioxide-equivalent by 2050. Total carbon stock protected is 786 gigatons of carbon dioxide-equivalent. \xa0\nDiscussion\nBenchmarks\nBenchmarks for this solution are rare. A World Resources Institute study calculated that secure forest tenure for indigenous people in Bolivia, Brazil, and Colombia could reduce emissions by 42.8–59.7 million metric tons of carbon dioxide-equivalent through 2035, on 148.9 million hectares. The Project Drawdown model shows a global impact of 288.6–431.2 million metric tons of carbon dioxide equivalent for 2035, on 869–1046 million hectares among\xa0our three scenarios. Comparing the ratio of million metric tons of carbon dioxide equivalent to million hectares, the World Resources Institute study benchmark is 0.28–0.40, while the Project Drawdown model calculates 0.33–0.41 in the two scenarios; thus, results are similar. Griscom et al. (2017)’s “natural climate solutions” calculates an annual impact from “avoided forest conversion” of 1.82–3.60 gigatons of carbon dioxide equivalent per year in 2030. It is not clear if their figure includes avoided land use from demand reduction\xa0or only forest protection. Note that Food sector solutions reduced food waste and plant-rich diets also incorporate substantial avoided land use change emissions not accounted for here. The Project Drawdown model shows 0.23–0.37 gigatons carbon dioxide-equivalent per year by 2030 for indigenous peoples’ forest tenure and 0.15–0.26 for forest protection, for a combined 0.38–0.63 gigatons carbon dioxide-equivalent per year in 2030', 'Limitations\nIncluding economic impacts (e.g., costs to governments and NGOs)\xa0would be a valuable addition to future updates', 'Conclusions\nDespite the fact that forests are degrading, although minimally, under the management of indigenous peoples, Project Drawdown advocates for the adoption of this solution due to its social benefits associated with the indigenous communities, better sustainability over other modes of forest protection, and the remoteness of many forest areas in hard climatic conditions which are difficult to be managed by any agency not living there. This solution addresses longstanding indigenous rights issues, protects carbon stocks equal to hundreds of gigatons of carbon dioxide, and provides a basis for sustainable rural livelihoods. As such, it should be a top priority for forest lands everywhere that indigenous people are striving to regain control of their traditional forests', '\n\n\n[1] Determining the total available land for a solution is a two-part process. The technical potential is based on the suitability of climate, soils, and slopes, and on degraded or non-degraded status. In the second stage, land is allocated using the Drawdown Agro-Ecological Zone model, based on priorities for each class of land. The total land allocated for each solution is capped at the solution’s maximum adoption in the Optimum Scenario. Thus, in most cases the total available land is less than the technical potential', '\n\n[2] Current adoption is defined as the amount of functional demand supplied by the solution in the base year of study. This study uses 2018 as the base year due to the availability of global adoption data for all Project Drawdown solutions evaluated', '\n\n[3] https://rightsandresources.org/en/publication/at-a-crossroads-trends-in-...']"
41,Insulation,"['Project Drawdown defines insulation as\xa0the use of high levels of improved materials in building envelopes that resist heat flow and regulate indoor temperatures. This solution replaces the conventional practice of using less thermal resistance in residential and commercial buildings', 'Insulating the wall and roof surface area of buildings is one of the most accessible and effective ways to reduce heating and cooling energy use—and, therefore, greenhouse gas emissions—in the built environment. Increasing insulation of older buildings through retrofit and increasing the average R-value of new building stock costs more than current normal practices, but has a significant return on investment from lower operating costs due to reductions in heating and cooling costs. All materials are not the same however since some require manufacture processes that generate much emissions, these are called embodied emissions of insulation. There are many low carbon bio-based materials like waste paper and hemp that can lower these embodied emissions significantly, but they may not be applicable in all cases', 'Methodology\nTo determine the emissions reduction potential of global adoption of high quality insulation in climate appropriate regions, the global stock of buildings was first analyzed to determine a total addressable market of building surface area appropriate for insulation. We separated the heating-dominated from the cooling-dominated areas and estimated possible heat loss or heat gain due to buildings of today’s average u-values in different climate zones according to heating-degree days and cooling-degree days. The energy loss (gain) is used to estimate the energy demand for heating (cooling) which was used to benchmark again global estimates for final space heating (cooling) energy. Then we adjusted the u-values to align with Passive House standards for heating dominated climates (and slightly less ambitious for cooling-dominated) and estimated the thermal energy saved. This was converted to emissions according to global average heating and cooling energy emissions factors', 'We additionally estimated the typical shares of materials used for insulation and estimated the embodied emissions of each but with an assumption that low-carbon materials like waste paper (cellulose) and hemp increase from an estimated 6 percent of total to 30 percent', 'Total Addressable Market\nThe total addressable market for insulation is based on estimated supply for commercial and residential building space in million square meters from 2020 to 2050, derived from the International Energy Agency’s (IEA’s) data', 'With very limited data, we have assumed that current adoption[1] of insulation corresponds to around 30 percent globally', 'Adoption Scenarios\nImpacts of increased adoption of insulation from 2020 to 2050 were generated based on two growth scenarios. These\xa0were assessed in comparison with\xa0a\xa0Reference\xa0Scenario, in which\xa0the solution’s market share was fixed at the current levels', '\nScenario 1: For this scenario, an insulation retrofit rate of 1.6 percent was applied', 'Scenario 2: For this scenario, an insulation retrofit rate of 2 percent was applied', '\nEmissions Model\nEmissions assumptions were based on a combination of emissions factors related to heating fuel and grid electricity factors for cooling energy using global average heating and cooling demands, and the emissions factors from the Intergovernmental Panel on Climate Change (IPCC). Additionally the embodied emissions from typical insulation materials were collected from industry sources', 'Financial Model\nFinancial variables were collected and assessed for the costs of a variety of common insulation materials, including cellulose, polyurethane, stone and glass wools. Estimated thickness of each material to obtain the required u-value were estimated and used to price the per square-meter insulation need of each material before weighting by market demand. Over time the market shares would shift as more low carbon materials are used, and this was taken into account. The average first cost per square meter of insulated surface was estimated as US$4.00 more than typical levels of insulation.[2] Operational savings were derived by multiplying the reduced heating and cooling use by the average costs for the type of heating or cooling that would have been delivered', 'Integration\nThe insulation solution was integrated with others in the Buildings Sector by first prioritizing all solutions according to the point of impact on building energy usage. This meant that building envelope solutions like insulation were first, building systems like building automation systems\xa0were second, and building applications like heat pumps were last.[3] The impact on building energy demand was calculated for highest priority solutions, and then lower priority solutions were adjusted accordingly. For integrating Project Drawdown solutions in the Building Sector, insulation was the first solution to be considered because of the low cost, likely adoption, and significant mitigation impact of bolstering the building envelope. All other building envelope and building solutions impacting heating and cooling use are impacted by insulation at the point of integration', 'Additionally, as this model’s result is partly dependent on the supply of biogenic low carbon materials like hemp, and waste materials like waste paper, Project Drawdown’s integrated biomass and integrated waste models included allocations for Insulation to ensure that no double counting or unrealistic projections occurred', 'Results\nScenario 1 results show a mitigation impact of 17 gigatons of carbon dioxide-equivalent emissions over the period 2020–2050 and US$21 trillion in energy savings. This scenarios estimates an additional US$751 billion in insulation cost. The increased adoption of insulation in Scenario 2 results in a mitigation impact of 19 gigatons of emissions for a cost of US$831 billion. \xa0It does, however, save an estimated US$24 trillion in heating and cooling costs', 'Discussion\nThere is little peer-reviewed literature assessing the potential global increased adoption of insulation, so the results developed require a significant number of assumptions and reasoned extrapolations of the data that does exist. Temperature variation and human comfort levels in buildings can significantly affect the adoption of insulation. Because of rising outside temperatures, Anthropogenic global warming is expected to decrease average energy used for heating buildings worldwide, but is also expected to drive more electricity use for cooling. These effects were not considered for the model prognostications', 'The impact of the low-carbon materials is noticeable. This contributed to a higher emission impact than would have been estimated. The building\xa0industry is coming to the realization that unless embodied emissions are taken into account when retrofitting or designing new buildings, significant emissions may be generated from the built environment. The need to have a holistic view on emissions caused by building construction is being recognized in greater amounts. Related Project Drawdown solutions on this topic are alternative cement\xa0and building with wood. Alternative cement\xa0is a\xa0way\xa0that one of the most common building materials, cement—currently the source of 5 percent\xa0of the world’s carbon dioxide emissions—can be made more carbon efficient. Building with wood, a Project Drawdown coming attraction, is also a potentially high-impact solution to reducing building embodied emissions', 'One reason why we did not apply the Passive House standard to cooling dominated climates is the large increase in embodied emissions that we estimated would occur to install insulation of such a high level. Part of this, we believe, is due to higher balance temperatures in some countries, and limited wealth in others. These, combined, result in lower use of cooling energy in the conventional case than what our data would suggest', '\n\n\n[1] Current adoption is defined as the amount of functional demand supplied by the solution in 2018. This study uses 2014 as the base year', '\n\n[2] All monetary values are presented in 2014 US$', '\n\n[3] Although we used the term “priority,”\xa0we do not mean to say that any solution was of greater importance than any other, but rather that for estimating total impact of all building solutions, we simply applied the impacts of some solutions before others, and used the output energy demand after application of a higher priority solution as the energy demand input to a lower priority solution.']"
